{
  "schema_version": "ppg-owner-decision/v0.1",
  "decision_id": "owner_decision_contribution_strength_v1",
  "status": "queued",
  "question": "Should the paper present the claim as a bounded controller-runtime contribution or a stronger general writing-automation claim?",
  "why_owner_gated": "This changes the paper's semantic position and cannot be inferred from validators alone.",
  "blocks": [
    "claim_boundary_map_candidate_v3"
  ],
  "options": [
    {
      "id": "bounded_controller_runtime",
      "label": "Bounded controller-runtime contribution",
      "effect": "Keep claims within current Phase 3 runtime evidence."
    },
    {
      "id": "general_writing_automation",
      "label": "General writing automation contribution",
      "effect": "Requires new owner approval and future evidence."
    }
  ],
  "selected_option": null,
  "evidence": [],
  "created_at": "2026-06-29",
  "answered_at": null
}
